{
  "layer": "china-vendor-evidence",
  "records": [
    {
      "asn": null,
      "confidence": "high",
      "evidence_type": "reachability_observation",
      "ip_family": null,
      "object_id": "cucloud:ai_api_endpoint:aisp-endpoint-28e5c1c868b21178",
      "object_type": "provider_service",
      "observed_at": "2026-10-12T03:28:22.588549Z",
      "prefix": null,
      "properties": {
        "authentication_error_or_head_rejection_is_not_service_closure": true,
        "certificate_not_after": "Jan  5 23:59:59 2027 GMT",
        "certificate_sha256": "cee736e8dd93ff61838b9cccc3bcd954efb8b967768f9111d535e37cb269328a",
        "completed_at": "2026-10-12T03:28:23.378676Z",
        "connected_ip": "59.80.22.5",
        "connection_and_tls_ms": 604.03,
        "dns_addresses": [
          "59.80.22.5"
        ],
        "dns_ip_tls_and_http_status_are_not_compute_geography": true,
        "endpoint_record_ids": [
          "cucloud:ai_api_endpoint:aisp-endpoint-28e5c1c868b21178"
        ],
        "hostname": "aigw-gzgy2.cucloud.cn",
        "http_method": "HEAD",
        "http_path": "/",
        "http_response_does_not_establish_model_availability": true,
        "http_status_line": "HTTP/1.1 404 Not Found",
        "measurement_vantage_geography": "not_established",
        "non_public_addresses_not_contacted": [],
        "observed_at": "2026-10-12T03:28:22.588549Z",
        "port": 443,
        "provider": "China Unicom Cloud",
        "source_urls": [
          "https://support.cucloud.cn/document/127/591/2357.html?arcid=7011&id=2357"
        ],
        "status": "tls_verified",
        "timing_scope": "Combined DNS/TCP/TLS/context setup elapsed time; not network RTT or inference latency",
        "tls_verification_required": true,
        "tls_version": "TLSv1.2",
        "ttl_not_observed": true
      },
      "provider": "China Unicom Cloud",
      "raw_source_ref": "data/raw/china-enrichment/endpoint-observations.20261011.json",
      "record_id": "network:china-vendor-evidence:endpoint-aigw-gzgy2-cucloud-cn",
      "relationship_type": null,
      "retrieved_at": "2026-10-11",
      "service": "china_vendor_network_evidence",
      "source_published_at": null,
      "source_scope": "observed",
      "source_sha256": "e62b349bb3f76dfc34b2c0dd4b28803f1c4c55d2bb9e0d5346b6e1729f9d5299",
      "source_url": "https://aigw-gzgy2.cucloud.cn/",
      "status": "tls_verified",
      "subject_id": "aigw-gzgy2.cucloud.cn",
      "subject_type": "measurement",
      "valid_from": null,
      "valid_to": null
    },
    {
      "asn": null,
      "confidence": "high",
      "evidence_type": "reachability_observation",
      "ip_family": null,
      "object_id": "cucloud:ai_api_endpoint:aisp-endpoint-968d09ef4dc8ac8b",
      "object_type": "provider_service",
      "observed_at": "2026-10-12T03:28:22.589213Z",
      "prefix": null,
      "properties": {
        "authentication_error_or_head_rejection_is_not_service_closure": true,
        "certificate_not_after": "Jan  5 23:59:59 2027 GMT",
        "certificate_sha256": "cee736e8dd93ff61838b9cccc3bcd954efb8b967768f9111d535e37cb269328a",
        "completed_at": "2026-10-12T03:28:23.313292Z",
        "connected_ip": "59.80.22.5",
        "connection_and_tls_ms": 554.003,
        "dns_addresses": [
          "59.80.22.5"
        ],
        "dns_ip_tls_and_http_status_are_not_compute_geography": true,
        "endpoint_record_ids": [
          "cucloud:ai_api_endpoint:aisp-endpoint-968d09ef4dc8ac8b"
        ],
        "hostname": "aigw-hbwh4.cucloud.cn",
        "http_method": "HEAD",
        "http_path": "/",
        "http_response_does_not_establish_model_availability": true,
        "http_status_line": "HTTP/1.1 404 Not Found",
        "measurement_vantage_geography": "not_established",
        "non_public_addresses_not_contacted": [],
        "observed_at": "2026-10-12T03:28:22.589213Z",
        "port": 443,
        "provider": "China Unicom Cloud",
        "source_urls": [
          "https://support.cucloud.cn/document/127/591/2357.html?arcid=7011&id=2357"
        ],
        "status": "tls_verified",
        "timing_scope": "Combined DNS/TCP/TLS/context setup elapsed time; not network RTT or inference latency",
        "tls_verification_required": true,
        "tls_version": "TLSv1.2",
        "ttl_not_observed": true
      },
      "provider": "China Unicom Cloud",
      "raw_source_ref": "data/raw/china-enrichment/endpoint-observations.20261011.json",
      "record_id": "network:china-vendor-evidence:endpoint-aigw-hbwh4-cucloud-cn",
      "relationship_type": null,
      "retrieved_at": "2026-10-11",
      "service": "china_vendor_network_evidence",
      "source_published_at": null,
      "source_scope": "observed",
      "source_sha256": "e62b349bb3f76dfc34b2c0dd4b28803f1c4c55d2bb9e0d5346b6e1729f9d5299",
      "source_url": "https://aigw-hbwh4.cucloud.cn/",
      "status": "tls_verified",
      "subject_id": "aigw-hbwh4.cucloud.cn",
      "subject_type": "measurement",
      "valid_from": null,
      "valid_to": null
    },
    {
      "asn": null,
      "confidence": "high",
      "evidence_type": "reachability_observation",
      "ip_family": null,
      "object_id": "cucloud:ai_api_endpoint:aisp-endpoint-8a8cefb47eae7c7b",
      "object_type": "provider_service",
      "observed_at": "2026-10-12T03:28:22.590377Z",
      "prefix": null,
      "properties": {
        "authentication_error_or_head_rejection_is_not_service_closure": true,
        "certificate_not_after": "Jan  5 23:59:59 2027 GMT",
        "certificate_sha256": "cee736e8dd93ff61838b9cccc3bcd954efb8b967768f9111d535e37cb269328a",
        "completed_at": "2026-10-12T03:28:23.424695Z",
        "connected_ip": "59.80.22.5",
        "connection_and_tls_ms": 657.135,
        "dns_addresses": [
          "59.80.22.5"
        ],
        "dns_ip_tls_and_http_status_are_not_compute_geography": true,
        "endpoint_record_ids": [
          "cucloud:ai_api_endpoint:aisp-endpoint-8a8cefb47eae7c7b"
        ],
        "hostname": "aigw-jnzs5.cucloud.cn",
        "http_method": "HEAD",
        "http_path": "/",
        "http_response_does_not_establish_model_availability": true,
        "http_status_line": "HTTP/1.1 404 Not Found",
        "measurement_vantage_geography": "not_established",
        "non_public_addresses_not_contacted": [],
        "observed_at": "2026-10-12T03:28:22.590377Z",
        "port": 443,
        "provider": "China Unicom Cloud",
        "source_urls": [
          "https://support.cucloud.cn/document/127/591/2357.html?arcid=7011&id=2357"
        ],
        "status": "tls_verified",
        "timing_scope": "Combined DNS/TCP/TLS/context setup elapsed time; not network RTT or inference latency",
        "tls_verification_required": true,
        "tls_version": "TLSv1.2",
        "ttl_not_observed": true
      },
      "provider": "China Unicom Cloud",
      "raw_source_ref": "data/raw/china-enrichment/endpoint-observations.20261011.json",
      "record_id": "network:china-vendor-evidence:endpoint-aigw-jnzs5-cucloud-cn",
      "relationship_type": null,
      "retrieved_at": "2026-10-11",
      "service": "china_vendor_network_evidence",
      "source_published_at": null,
      "source_scope": "observed",
      "source_sha256": "e62b349bb3f76dfc34b2c0dd4b28803f1c4c55d2bb9e0d5346b6e1729f9d5299",
      "source_url": "https://aigw-jnzs5.cucloud.cn/",
      "status": "tls_verified",
      "subject_id": "aigw-jnzs5.cucloud.cn",
      "subject_type": "measurement",
      "valid_from": null,
      "valid_to": null
    },
    {
      "asn": null,
      "confidence": "high",
      "evidence_type": "reachability_observation",
      "ip_family": null,
      "object_id": "cucloud:ai_api_endpoint:aisp-endpoint-fa62184dfeec2fcf",
      "object_type": "provider_service",
      "observed_at": "2026-10-12T03:28:22.593876Z",
      "prefix": null,
      "properties": {
        "authentication_error_or_head_rejection_is_not_service_closure": true,
        "certificate_not_after": "Jan  5 23:59:59 2027 GMT",
        "certificate_sha256": "cee736e8dd93ff61838b9cccc3bcd954efb8b967768f9111d535e37cb269328a",
        "completed_at": "2026-10-12T03:28:23.407419Z",
        "connected_ip": "59.80.22.5",
        "connection_and_tls_ms": 624.984,
        "dns_addresses": [
          "59.80.22.5"
        ],
        "dns_ip_tls_and_http_status_are_not_compute_geography": true,
        "endpoint_record_ids": [
          "cucloud:ai_api_endpoint:aisp-endpoint-fa62184dfeec2fcf"
        ],
        "hostname": "aigw-nmhhht.cucloud.cn",
        "http_method": "HEAD",
        "http_path": "/",
        "http_response_does_not_establish_model_availability": true,
        "http_status_line": "HTTP/1.1 404 Not Found",
        "measurement_vantage_geography": "not_established",
        "non_public_addresses_not_contacted": [],
        "observed_at": "2026-10-12T03:28:22.593876Z",
        "port": 443,
        "provider": "China Unicom Cloud",
        "source_urls": [
          "https://support.cucloud.cn/document/127/591/2357.html?arcid=7011&id=2357"
        ],
        "status": "tls_verified",
        "timing_scope": "Combined DNS/TCP/TLS/context setup elapsed time; not network RTT or inference latency",
        "tls_verification_required": true,
        "tls_version": "TLSv1.2",
        "ttl_not_observed": true
      },
      "provider": "China Unicom Cloud",
      "raw_source_ref": "data/raw/china-enrichment/endpoint-observations.20261011.json",
      "record_id": "network:china-vendor-evidence:endpoint-aigw-nmhhht-cucloud-cn",
      "relationship_type": null,
      "retrieved_at": "2026-10-11",
      "service": "china_vendor_network_evidence",
      "source_published_at": null,
      "source_scope": "observed",
      "source_sha256": "e62b349bb3f76dfc34b2c0dd4b28803f1c4c55d2bb9e0d5346b6e1729f9d5299",
      "source_url": "https://aigw-nmhhht.cucloud.cn/",
      "status": "tls_verified",